{
  "schema_version": "1.0.0",
  "run_id": "20261009T081500Z_elbow_s42",
  "stage": "elbow",
  "status": "done",
  "seed": 42,
  "resumed_from": null,
  "started_utc": "2026-10-09T08:15:00Z",
  "finished_utc": "2026-10-09T08:15:31Z",
  "config": {"schema_version": "1.0.0", "stage": "elbow", "seed": 42, "note": "nguyên văn train-config.*.json đã dùng; rút gọn ở ví dụ này"},
  "library_versions": {"python": "3.11.15", "torch": "2.14.1", "numpy": "2.4.6", "gymnasium": "1.4.0", "mujoco": "3.15.0", "myo-sim": "0.2.3", "tensorboard": "2.21.0"},
  "model": {"sha256": "384dcb555561287fe39d960aba6496db8b825bebd21df3873bb07920a886066f", "source": "myo_sim/models/legacy/elbow/myoelbow_1dof6muscles.xml", "muscle_names": ["TRIlong", "TRIlat", "TRImed", "BIClong", "BICshort", "BRA"]},
  "device": {"kind": "cpu", "name": null},
  "checkpoints": [
    {
      "schema_version": "1.0.0",
      "path": "checkpoints/ckpt_u000001.pt",
      "kind": "periodic",
      "update_idx": 1,
      "env_steps": 2048,
      "sha256": "0000000000000000000000000000000000000000000000000000000000000002",
      "created_utc": "2026-10-09T08:15:16Z",
      "model_sha256": "384dcb555561287fe39d960aba6496db8b825bebd21df3873bb07920a886066f",
      "components": ["actor", "critic", "obs_normalizer", "optimizer", "seed", "rng_state"],
      "library_versions": {"torch": "2.14.1", "numpy": "2.4.6"},
      "finite": true
    },
    {
      "schema_version": "1.0.0",
      "path": "checkpoints/ckpt_u000002_final.pt",
      "kind": "final",
      "update_idx": 2,
      "env_steps": 4096,
      "sha256": "0000000000000000000000000000000000000000000000000000000000000001",
      "created_utc": "2026-10-09T08:15:30Z",
      "model_sha256": "384dcb555561287fe39d960aba6496db8b825bebd21df3873bb07920a886066f",
      "components": ["actor", "critic", "obs_normalizer", "optimizer", "seed", "rng_state"],
      "library_versions": {"torch": "2.14.1", "numpy": "2.4.6"},
      "finite": true
    }
  ],
  "reward_metrics": {"n_updates": 2, "n_episodes": 41, "head_updates": 2, "head_mean_return": [-52.1, -50.7], "first_mean_return": -52.1, "last_mean_return": -50.7, "success_rate": 0.0},
  "throughput": {"env_steps": 4096, "env_steps_per_second": 1500.0, "wall_clock_seconds": 30.7},
  "resources": {"cpu_model": "ví dụ CPU", "cpu_logical_cores": 12, "cpu_utilization_pct": 9.5, "ram_peak_mb": 780.0, "gpu_name": null, "gpu_utilization_pct": null, "vram_peak_mb": null},
  "numeric_health": {"nan_count": 0, "inf_count": 0},
  "reproducibility": {"rel_tolerance": 1e-6, "head_updates": 10, "device_kind": "cpu", "torch_threads": 1, "deterministic_algorithms": true},
  "ui": {"mode": "none", "url": null, "view3d": false},
  "error": null
}
